{
  "schema_version": "1.0.0",
  "profile_name": "quantum_storage_v1",
  "profile_version": "1.0.0",
  "status": "review_required",
  "distributor_name": "Quantum Storage",
  "distributor_id": null,
  "description": "Pilot profile for Quantum Storage workbook family F034.",
  "applicable_family_ids": ["F034"],
  "workbook_match_rules": {
    "filename_patterns": ["Quantum Storage.*\\.xlsx$"],
    "sheet_name_patterns": ["^Sheet1$"],
    "required_headers": ["MODEL NO.", "DESCRIPTION", "UOM", "List Price"],
    "optional_headers": ["CTN QTY", "Discounted"],
    "forbidden_headers": [],
    "minimum_match_score": 7
  },
  "sheet_rules": {
    "exact_sheet_name": "Sheet1",
    "case_insensitive_sheet_name": null,
    "regex_sheet_name": null,
    "include_patterns": [],
    "exclude_patterns": [],
    "include_hidden_sheets": false,
    "process_multiple_matching_sheets": false
  },
  "header_rules": {
    "exact_header_row": 1,
    "candidate_row_range": { "start": 1, "end": 5 },
    "required_header_terms": ["MODEL NO.", "DESCRIPTION", "UOM", "List Price"],
    "optional_header_terms": ["CTN QTY", "Discounted"],
    "multi_row_header": false,
    "merged_header_handling": "error",
    "normalized_header_matching": true,
    "minimum_header_match_score": 4
  },
  "data_region_rules": {
    "explicit_first_data_row": 2,
    "first_row_after_detected_header": false,
    "explicit_last_row": null,
    "stop_after_consecutive_blank_required_field_rows": 25,
    "maximum_row_limit": null,
    "skip_hidden_rows": true,
    "include_hidden_rows_with_warning": false,
    "skip_subtotal_and_total_rows": true,
    "repeated_header_detection": true
  },
  "column_mappings": [
    {
      "canonical_field": "manufacturer_part_number",
      "source_header": "MODEL NO.",
      "source_header_aliases": ["Model No", "Model"],
      "source_column_letter": "A",
      "source_column_index": 1,
      "required": true,
      "transforms": ["normalize_identifier"],
      "fallback_source_headers": [],
      "constant_value": null,
      "default_value": null,
      "notes": "Model number is the stable item identifier."
    },
    {
      "canonical_field": "item_description_raw",
      "source_header": "DESCRIPTION",
      "source_header_aliases": ["Description"],
      "source_column_letter": "B",
      "source_column_index": 2,
      "required": true,
      "transforms": ["normalize_description"],
      "fallback_source_headers": [],
      "constant_value": null,
      "default_value": null,
      "notes": ""
    },
    {
      "canonical_field": "raw_uom",
      "source_header": "UOM",
      "source_header_aliases": [],
      "source_column_letter": "C",
      "source_column_index": 3,
      "required": false,
      "transforms": ["normalize_uom"],
      "fallback_source_headers": [],
      "constant_value": null,
      "default_value": null,
      "notes": "Unknown UOM values create warnings."
    },
    {
      "canonical_field": "pack_size",
      "source_header": "CTN QTY",
      "source_header_aliases": ["Carton Qty"],
      "source_column_letter": "D",
      "source_column_index": 4,
      "required": false,
      "transforms": ["parse_pack_size"],
      "fallback_source_headers": [],
      "constant_value": null,
      "default_value": null,
      "notes": "No each-price conversion is inferred from carton quantity."
    },
    {
      "canonical_field": "price",
      "source_header": "List Price",
      "source_header_aliases": [],
      "source_column_letter": "E",
      "source_column_index": 5,
      "required": true,
      "transforms": ["parse_currency"],
      "fallback_source_headers": [],
      "constant_value": null,
      "default_value": null,
      "notes": "List Price is used for pilot dry-run review."
    }
  ],
  "transforms": ["normalize_identifier", "normalize_description", "normalize_uom", "parse_pack_size", "parse_currency"],
  "default_values": {
    "currency": { "source": "constant", "value": "USD", "manifest_field": null, "required": false },
    "contract_name": { "source": "manifest", "value": null, "manifest_field": "contract_name", "required": false },
    "contract_number": { "source": "manifest", "value": null, "manifest_field": "contract_number", "required": false },
    "account_number": { "source": "manifest", "value": null, "manifest_field": "account_number", "required": false },
    "location": { "source": "manifest", "value": null, "manifest_field": "location", "required": false },
    "effective_date": { "source": "manifest", "value": null, "manifest_field": "effective_date", "required": false },
    "expiration_date": { "source": "manifest", "value": null, "manifest_field": "expiration_date", "required": false }
  },
  "validation_rules": {
    "price_required": true,
    "description_required": true,
    "item_identifier_required": true,
    "uom_warning_only": true
  },
  "exception_rules": {
    "unknown_uom": "warning",
    "missing_uom": "warning",
    "pack_size_not_parsed": "warning"
  },
  "notes": "Review whether List Price or Discounted should drive contract pricing before approval.",
  "created_at": "2026-06-17",
  "reviewed_by": null,
  "review_status": "not_reviewed"
}
