{
  "applicable_family_ids": [
    "F035"
  ],
  "applied_decision_ids": [
    "health_care_logistics_v1:base_uom",
    "health_care_logistics_v1:contract_metadata",
    "health_care_logistics_v1:effective_date_source",
    "health_care_logistics_v1:item_identifier",
    "health_care_logistics_v1:price_uom",
    "health_care_logistics_v1:pricing_basis",
    "health_care_logistics_v1:row_exclusion_policy",
    "metadata_policy:account_number_required_before_publish",
    "metadata_policy:contract_number_required_before_publish",
    "metadata_policy:effective_date_required_before_publish",
    "metadata_policy:expiration_date_nullable",
    "metadata_policy:location_required_before_publish",
    "metadata_policy:metadata_source_policy"
  ],
  "column_mappings": [
    {
      "canonical_field": "distributor_sku",
      "constant_value": null,
      "default_value": null,
      "fallback_source_headers": [],
      "notes": "Item # is the distributor item identifier.",
      "required": true,
      "source_column_index": 1,
      "source_column_letter": "A",
      "source_header": "Item #",
      "source_header_aliases": [
        "Item Number"
      ],
      "transforms": [
        "normalize_identifier"
      ]
    },
    {
      "canonical_field": "item_description_raw",
      "constant_value": null,
      "default_value": null,
      "fallback_source_headers": [],
      "notes": "",
      "required": true,
      "source_column_index": 2,
      "source_column_letter": "B",
      "source_header": "Item Description",
      "source_header_aliases": [
        "Description"
      ],
      "transforms": [
        "normalize_description"
      ]
    },
    {
      "canonical_field": "raw_uom",
      "constant_value": null,
      "default_value": null,
      "fallback_source_headers": [
        "Sales Unit"
      ],
      "notes": "Sales Unit is retained as review context through fallback if UOM is unavailable.",
      "required": false,
      "source_column_index": 3,
      "source_column_letter": "C",
      "source_header": "UOM",
      "source_header_aliases": [],
      "transforms": [
        "normalize_uom"
      ]
    },
    {
      "canonical_field": "price",
      "constant_value": null,
      "default_value": null,
      "fallback_source_headers": [],
      "notes": "",
      "required": true,
      "source_column_index": 5,
      "source_column_letter": "E",
      "source_header": "Price",
      "source_header_aliases": [],
      "transforms": [
        "parse_currency"
      ]
    },
    {
      "canonical_field": "effective_date",
      "constant_value": null,
      "default_value": null,
      "fallback_source_headers": [],
      "notes": "",
      "required": false,
      "source_column_index": 6,
      "source_column_letter": "F",
      "source_header": "Price Effective Date",
      "source_header_aliases": [],
      "transforms": [
        "parse_date"
      ]
    },
    {
      "canonical_field": "expiration_date",
      "constant_value": null,
      "default_value": null,
      "fallback_source_headers": [],
      "notes": "",
      "required": false,
      "source_column_index": 7,
      "source_column_letter": "G",
      "source_header": "Price Expiration Date",
      "source_header_aliases": [],
      "transforms": [
        "parse_date"
      ]
    },
    {
      "canonical_field": "raw_price_uom",
      "constant_value": null,
      "default_value": null,
      "fallback_source_headers": [
        "Sales Unit"
      ],
      "notes": "Price UOM captured from the approved UOM source. Decision: health_care_logistics_v1:price_uom.",
      "required": false,
      "source_column_index": 3,
      "source_column_letter": "C",
      "source_header": "UOM",
      "source_header_aliases": [],
      "transforms": [
        "normalize_uom"
      ]
    }
  ],
  "created_at": "2026-06-17",
  "data_region_rules": {
    "explicit_first_data_row": 4,
    "explicit_last_row": null,
    "first_row_after_detected_header": false,
    "include_hidden_rows_with_warning": false,
    "maximum_row_limit": null,
    "repeated_header_detection": true,
    "skip_hidden_rows": true,
    "skip_subtotal_and_total_rows": true,
    "stop_after_consecutive_blank_required_field_rows": 20
  },
  "decision_references": {
    "base_uom": {
      "decided_at": "2026-06-25T16:07:44Z",
      "decided_by": "Steven Caban",
      "decision_id": "health_care_logistics_v1:base_uom",
      "selected_option": "extend_schema_pending_publish"
    },
    "contract_metadata": {
      "decided_at": "2026-06-25T16:07:44Z",
      "decided_by": "Steven Caban",
      "decision_id": "health_care_logistics_v1:contract_metadata",
      "selected_option": "manifest"
    },
    "effective_date_source": {
      "decided_at": "2026-06-25T16:07:44Z",
      "decided_by": "Steven Caban",
      "decision_id": "health_care_logistics_v1:effective_date_source",
      "selected_option": "workbook_columns"
    },
    "item_identifier": {
      "decided_at": "2026-06-25T16:07:44Z",
      "decided_by": "Steven Caban",
      "decision_id": "health_care_logistics_v1:item_identifier",
      "selected_option": "Item # [distributor_sku]"
    },
    "metadata_policy": {
      "account_number_required_before_publish": "optional_before_publish",
      "contract_number_required_before_publish": "required_before_publish",
      "effective_date_required_before_publish": "required_before_publish",
      "expiration_date_nullable": "nullable_allowed",
      "location_required_before_publish": "optional_before_publish",
      "metadata_source_policy": "manifest"
    },
    "price_uom": {
      "decided_at": "2026-06-25T16:07:44Z",
      "decided_by": "Steven Caban",
      "decision_id": "health_care_logistics_v1:price_uom",
      "selected_option": "UOM"
    },
    "pricing_basis": {
      "decided_at": "2026-06-25T16:07:44Z",
      "decided_by": "Steven Caban",
      "decision_id": "health_care_logistics_v1:pricing_basis",
      "selected_option": "Price [unknown]"
    },
    "row_exclusion_policy": {
      "decided_at": "2026-06-25T16:07:44Z",
      "decided_by": "Steven Caban",
      "decision_id": "health_care_logistics_v1:row_exclusion_policy",
      "selected_option": "keep_identifier_description_no_price_blocking"
    }
  },
  "default_values": {
    "account_number": {
      "manifest_field": "account_number",
      "required": false,
      "source": "manifest",
      "value": null
    },
    "contract_name": {
      "manifest_field": "contract_name",
      "required": false,
      "source": "manifest",
      "value": null
    },
    "contract_number": {
      "manifest_field": "contract_number",
      "required": true,
      "source": "manifest",
      "value": null
    },
    "currency": {
      "manifest_field": null,
      "required": false,
      "source": "constant",
      "value": "USD"
    },
    "location": {
      "manifest_field": "location",
      "required": false,
      "source": "manifest",
      "value": null
    }
  },
  "description": "Pilot profile for Health Care Logistics workbook family F035.",
  "distributor_id": null,
  "distributor_name": "Health Care Logistics",
  "exception_rules": {
    "metadata_conflict": "blocking",
    "missing_effective_date": "warning",
    "missing_expiration_date": "warning",
    "missing_uom": "warning",
    "required_metadata_missing": "blocking",
    "unknown_uom": "warning"
  },
  "header_rules": {
    "candidate_row_range": {
      "end": 8,
      "start": 1
    },
    "exact_header_row": 3,
    "merged_header_handling": "error",
    "minimum_header_match_score": 4,
    "multi_row_header": false,
    "normalized_header_matching": true,
    "optional_header_terms": [
      "Sales Unit",
      "Price Effective Date",
      "Price Expiration Date"
    ],
    "required_header_terms": [
      "Item #",
      "Item Description",
      "UOM",
      "Price"
    ]
  },
  "notes": "Decision-applied v2 pilot profile. Status remains review_required and review_status remains not_reviewed. No unit conversions, each-price calculations, or unapproved price fallbacks are inferred.",
  "predecessor_profile": "health_care_logistics_v1",
  "predecessor_profile_version": "1.0.0",
  "profile_name": "health_care_logistics_v2",
  "profile_version": "2.0.0",
  "review_status": "not_reviewed",
  "reviewed_by": null,
  "schema_version": "1.0.0",
  "sheet_rules": {
    "case_insensitive_sheet_name": null,
    "exact_sheet_name": "JAN 2026 Standard",
    "exclude_patterns": [],
    "include_hidden_sheets": false,
    "include_patterns": [],
    "process_multiple_matching_sheets": false,
    "regex_sheet_name": null
  },
  "status": "review_required",
  "transforms": [
    "normalize_identifier",
    "normalize_description",
    "normalize_uom",
    "parse_currency",
    "parse_date"
  ],
  "validation_rules": {
    "description_required": true,
    "expiration_date_nullable": true,
    "item_identifier_required": true,
    "metadata_source_policy": "manifest",
    "price_required": true,
    "required_metadata_fields": [
      "contract_number",
      "effective_date"
    ],
    "uom_warning_only": true
  },
  "workbook_match_rules": {
    "filename_patterns": [
      "Health Care Logistics.*\\.xlsx$"
    ],
    "forbidden_headers": [],
    "minimum_match_score": 8,
    "optional_headers": [
      "Sales Unit",
      "Price Effective Date",
      "Price Expiration Date"
    ],
    "required_headers": [
      "Item #",
      "Item Description",
      "UOM",
      "Price"
    ],
    "sheet_name_patterns": [
      "JAN 2026 Standard"
    ]
  }
}
