{
  "applicable_family_ids": [
    "F034"
  ],
  "applied_decision_ids": [
    "metadata_policy:account_number_required_before_publish",
    "metadata_policy:contract_number_required_before_publish",
    "metadata_policy:effective_date_required_before_publish",
    "metadata_policy:expiration_date_nullable",
    "metadata_policy:location_required_before_publish",
    "metadata_policy:metadata_source_policy",
    "quantum_storage_v1:base_uom",
    "quantum_storage_v1:contract_metadata",
    "quantum_storage_v1:effective_date_source",
    "quantum_storage_v1:item_identifier",
    "quantum_storage_v1:price_uom",
    "quantum_storage_v1:pricing_basis",
    "quantum_storage_v1:row_exclusion_policy"
  ],
  "column_mappings": [
    {
      "canonical_field": "manufacturer_part_number",
      "constant_value": null,
      "default_value": null,
      "fallback_source_headers": [],
      "notes": "Model number is the stable item identifier.",
      "required": true,
      "source_column_index": 1,
      "source_column_letter": "A",
      "source_header": "MODEL NO.",
      "source_header_aliases": [
        "Model No",
        "Model"
      ],
      "transforms": [
        "normalize_identifier"
      ]
    },
    {
      "canonical_field": "item_description_raw",
      "constant_value": null,
      "default_value": null,
      "fallback_source_headers": [],
      "notes": "",
      "required": true,
      "source_column_index": 2,
      "source_column_letter": "B",
      "source_header": "DESCRIPTION",
      "source_header_aliases": [
        "Description"
      ],
      "transforms": [
        "normalize_description"
      ]
    },
    {
      "canonical_field": "raw_uom",
      "constant_value": null,
      "default_value": null,
      "fallback_source_headers": [],
      "notes": "Unknown UOM values create warnings.",
      "required": false,
      "source_column_index": 3,
      "source_column_letter": "C",
      "source_header": "UOM",
      "source_header_aliases": [],
      "transforms": [
        "normalize_uom"
      ]
    },
    {
      "canonical_field": "pack_size",
      "constant_value": null,
      "default_value": null,
      "fallback_source_headers": [],
      "notes": "No each-price conversion is inferred from carton quantity.",
      "required": false,
      "source_column_index": 4,
      "source_column_letter": "D",
      "source_header": "CTN QTY",
      "source_header_aliases": [
        "Carton Qty"
      ],
      "transforms": [
        "parse_pack_size"
      ]
    },
    {
      "canonical_field": "price",
      "constant_value": null,
      "default_value": null,
      "fallback_source_headers": [],
      "notes": "Approved negotiated-price source; List Price is not used as fallback.",
      "required": true,
      "source_column_index": null,
      "source_column_letter": null,
      "source_header": "Discounted",
      "source_header_aliases": [],
      "transforms": [
        "parse_currency"
      ]
    },
    {
      "canonical_field": "raw_price_uom",
      "constant_value": null,
      "default_value": null,
      "fallback_source_headers": [],
      "notes": "Price UOM captured from the approved UOM source. Decision: quantum_storage_v1:price_uom.",
      "required": false,
      "source_column_index": 3,
      "source_column_letter": "C",
      "source_header": "UOM",
      "source_header_aliases": [],
      "transforms": [
        "normalize_uom"
      ]
    }
  ],
  "created_at": "2026-06-17",
  "data_region_rules": {
    "explicit_first_data_row": 2,
    "explicit_last_row": null,
    "first_row_after_detected_header": false,
    "include_hidden_rows_with_warning": false,
    "maximum_row_limit": null,
    "repeated_header_detection": true,
    "skip_hidden_rows": true,
    "skip_subtotal_and_total_rows": true,
    "stop_after_consecutive_blank_required_field_rows": 25
  },
  "decision_references": {
    "base_uom": {
      "decided_at": "2026-06-25T16:07:44Z",
      "decided_by": "Steven Caban",
      "decision_id": "quantum_storage_v1:base_uom",
      "selected_option": "extend_schema_pending_publish"
    },
    "contract_metadata": {
      "decided_at": "2026-06-25T16:07:44Z",
      "decided_by": "Steven Caban",
      "decision_id": "quantum_storage_v1:contract_metadata",
      "selected_option": "manifest"
    },
    "effective_date_source": {
      "decided_at": "2026-06-25T16:07:44Z",
      "decided_by": "Steven Caban",
      "decision_id": "quantum_storage_v1:effective_date_source",
      "selected_option": "manifest"
    },
    "item_identifier": {
      "decided_at": "2026-06-25T16:07:44Z",
      "decided_by": "Steven Caban",
      "decision_id": "quantum_storage_v1:item_identifier",
      "selected_option": "MODEL NO. [manufacturer_part_number]"
    },
    "metadata_policy": {
      "account_number_required_before_publish": "optional_before_publish",
      "contract_number_required_before_publish": "required_before_publish",
      "effective_date_required_before_publish": "required_before_publish",
      "expiration_date_nullable": "nullable_allowed",
      "location_required_before_publish": "optional_before_publish",
      "metadata_source_policy": "manifest"
    },
    "price_uom": {
      "decided_at": "2026-06-25T16:07:44Z",
      "decided_by": "Steven Caban",
      "decision_id": "quantum_storage_v1:price_uom",
      "selected_option": "UOM"
    },
    "pricing_basis": {
      "decided_at": "2026-06-25T16:07:44Z",
      "decided_by": "Steven Caban",
      "decision_id": "quantum_storage_v1:pricing_basis",
      "selected_option": "Discounted [discounted_price]"
    },
    "row_exclusion_policy": {
      "decided_at": "2026-06-25T16:07:44Z",
      "decided_by": "Steven Caban",
      "decision_id": "quantum_storage_v1:row_exclusion_policy",
      "selected_option": "keep_identifier_description_no_price_blocking"
    }
  },
  "default_values": {
    "account_number": {
      "manifest_field": "account_number",
      "required": false,
      "source": "manifest",
      "value": null
    },
    "contract_name": {
      "manifest_field": "contract_name",
      "required": false,
      "source": "manifest",
      "value": null
    },
    "contract_number": {
      "manifest_field": "contract_number",
      "required": true,
      "source": "manifest",
      "value": null
    },
    "currency": {
      "manifest_field": null,
      "required": false,
      "source": "constant",
      "value": "USD"
    },
    "effective_date": {
      "manifest_field": "effective_date",
      "required": true,
      "source": "manifest",
      "value": null
    },
    "expiration_date": {
      "manifest_field": "expiration_date",
      "required": false,
      "source": "manifest",
      "value": null
    },
    "location": {
      "manifest_field": "location",
      "required": false,
      "source": "manifest",
      "value": null
    }
  },
  "description": "Pilot profile for Quantum Storage workbook family F034.",
  "distributor_id": null,
  "distributor_name": "Quantum Storage",
  "exception_rules": {
    "metadata_conflict": "blocking",
    "missing_uom": "warning",
    "pack_size_not_parsed": "warning",
    "required_metadata_missing": "blocking",
    "unknown_uom": "warning"
  },
  "header_rules": {
    "candidate_row_range": {
      "end": 5,
      "start": 1
    },
    "exact_header_row": 1,
    "merged_header_handling": "error",
    "minimum_header_match_score": 4,
    "multi_row_header": false,
    "normalized_header_matching": true,
    "optional_header_terms": [
      "CTN QTY",
      "Discounted",
      "List Price"
    ],
    "required_header_terms": [
      "MODEL NO.",
      "DESCRIPTION",
      "UOM",
      "Discounted"
    ]
  },
  "notes": "Decision-applied v2 pilot profile. Status remains review_required and review_status remains not_reviewed. No unit conversions, each-price calculations, or unapproved price fallbacks are inferred.",
  "predecessor_profile": "quantum_storage_v1",
  "predecessor_profile_version": "1.0.0",
  "profile_name": "quantum_storage_v2",
  "profile_version": "2.0.0",
  "review_status": "not_reviewed",
  "reviewed_by": null,
  "schema_version": "1.0.0",
  "sheet_rules": {
    "case_insensitive_sheet_name": null,
    "exact_sheet_name": "Sheet1",
    "exclude_patterns": [],
    "include_hidden_sheets": false,
    "include_patterns": [],
    "process_multiple_matching_sheets": false,
    "regex_sheet_name": null
  },
  "status": "review_required",
  "transforms": [
    "normalize_identifier",
    "normalize_description",
    "normalize_uom",
    "parse_pack_size",
    "parse_currency"
  ],
  "validation_rules": {
    "description_required": true,
    "expiration_date_nullable": true,
    "item_identifier_required": true,
    "metadata_source_policy": "manifest",
    "price_required": true,
    "required_metadata_fields": [
      "contract_number",
      "effective_date"
    ],
    "uom_warning_only": true
  },
  "workbook_match_rules": {
    "filename_patterns": [
      "Quantum Storage.*\\.xlsx$"
    ],
    "forbidden_headers": [],
    "minimum_match_score": 7,
    "optional_headers": [
      "CTN QTY",
      "Discounted",
      "List Price"
    ],
    "required_headers": [
      "MODEL NO.",
      "DESCRIPTION",
      "UOM",
      "Discounted"
    ],
    "sheet_name_patterns": [
      "^Sheet1$"
    ]
  }
}
