{
  "applicable_family_ids": [
    "F003"
  ],
  "applied_decision_ids": [
    "detecto_v1:base_uom",
    "detecto_v1:contract_metadata",
    "detecto_v1:effective_date_source",
    "detecto_v1:item_identifier",
    "detecto_v1:price_uom",
    "detecto_v1:pricing_basis",
    "detecto_v1:profile_variant",
    "detecto_v1:row_exclusion_policy",
    "metadata_policy:account_number_required_before_publish",
    "metadata_policy:contract_number_required_before_publish",
    "metadata_policy:effective_date_required_before_publish",
    "metadata_policy:expiration_date_nullable",
    "metadata_policy:location_required_before_publish",
    "metadata_policy:metadata_source_policy"
  ],
  "column_mappings": [
    {
      "canonical_field": "model_number",
      "constant_value": null,
      "default_value": null,
      "fallback_source_headers": [],
      "notes": "Approved as model_number; not duplicated into manufacturer_part_number.",
      "required": true,
      "source_column_index": 1,
      "source_column_letter": "A",
      "source_header": "Model",
      "source_header_aliases": [
        "MODEL"
      ],
      "transforms": [
        "normalize_identifier"
      ]
    },
    {
      "canonical_field": "gtin",
      "constant_value": null,
      "default_value": null,
      "fallback_source_headers": [],
      "notes": "UPC is optional supporting identity.",
      "required": false,
      "source_column_index": 4,
      "source_column_letter": "D",
      "source_header": "UPC",
      "source_header_aliases": [],
      "transforms": [
        "normalize_identifier"
      ]
    },
    {
      "canonical_field": "item_description_raw",
      "constant_value": null,
      "default_value": null,
      "fallback_source_headers": [
        "Item Description"
      ],
      "notes": "Sales Description appears to be the richer product description.",
      "required": true,
      "source_column_index": 13,
      "source_column_letter": "M",
      "source_header": "Sales Description",
      "source_header_aliases": [],
      "transforms": [
        "normalize_description"
      ]
    },
    {
      "canonical_field": "raw_uom",
      "constant_value": null,
      "default_value": null,
      "fallback_source_headers": [],
      "notes": "Missing or unknown UOM produces a warning.",
      "required": false,
      "source_column_index": 5,
      "source_column_letter": "E",
      "source_header": "Stock UOM",
      "source_header_aliases": [],
      "transforms": [
        "normalize_uom"
      ]
    },
    {
      "canonical_field": "price",
      "constant_value": null,
      "default_value": null,
      "fallback_source_headers": [],
      "notes": "Net Price is the proposed contract-pricing value for review.",
      "required": true,
      "source_column_index": 12,
      "source_column_letter": "L",
      "source_header": "Net Price",
      "source_header_aliases": [],
      "transforms": [
        "parse_currency"
      ]
    },
    {
      "canonical_field": "minimum_quantity",
      "constant_value": null,
      "default_value": null,
      "fallback_source_headers": [],
      "notes": "Quantity tier start when present.",
      "required": false,
      "source_column_index": 10,
      "source_column_letter": "J",
      "source_header": "Start Qty",
      "source_header_aliases": [],
      "transforms": [
        "parse_decimal"
      ]
    },
    {
      "canonical_field": "raw_price_uom",
      "constant_value": null,
      "default_value": null,
      "fallback_source_headers": [],
      "notes": "Price UOM captured from the approved UOM source. Decision: detecto_v1:price_uom.",
      "required": false,
      "source_column_index": 5,
      "source_column_letter": "E",
      "source_header": "Stock UOM",
      "source_header_aliases": [],
      "transforms": [
        "normalize_uom"
      ]
    }
  ],
  "created_at": "2026-06-17",
  "data_region_rules": {
    "explicit_first_data_row": 27,
    "explicit_last_row": null,
    "first_row_after_detected_header": false,
    "include_hidden_rows_with_warning": false,
    "maximum_row_limit": null,
    "repeated_header_detection": true,
    "skip_hidden_rows": true,
    "skip_subtotal_and_total_rows": true,
    "stop_after_consecutive_blank_required_field_rows": 20
  },
  "decision_references": {
    "base_uom": {
      "decided_at": "2026-06-25T16:07:44Z",
      "decided_by": "Steven Caban",
      "decision_id": "detecto_v1:base_uom",
      "selected_option": "extend_schema_pending_publish"
    },
    "contract_metadata": {
      "decided_at": "2026-06-25T16:07:44Z",
      "decided_by": "Steven Caban",
      "decision_id": "detecto_v1:contract_metadata",
      "selected_option": "manifest"
    },
    "effective_date_source": {
      "decided_at": "2026-06-25T16:07:44Z",
      "decided_by": "Steven Caban",
      "decision_id": "detecto_v1:effective_date_source",
      "selected_option": "manifest"
    },
    "item_identifier": {
      "decided_at": "2026-06-25T16:07:44Z",
      "decided_by": "Steven Caban",
      "decision_id": "detecto_v1:item_identifier",
      "selected_option": "Model [model_number]"
    },
    "metadata_policy": {
      "account_number_required_before_publish": "optional_before_publish",
      "contract_number_required_before_publish": "required_before_publish",
      "effective_date_required_before_publish": "required_before_publish",
      "expiration_date_nullable": "nullable_allowed",
      "location_required_before_publish": "optional_before_publish",
      "metadata_source_policy": "manifest"
    },
    "price_uom": {
      "decided_at": "2026-06-25T16:07:44Z",
      "decided_by": "Steven Caban",
      "decision_id": "detecto_v1:price_uom",
      "selected_option": "Stock UOM"
    },
    "pricing_basis": {
      "decided_at": "2026-06-24T22:44:14Z",
      "decided_by": "Steven Caban",
      "decision_id": "detecto_v1:pricing_basis",
      "selected_option": "Net Price [net_price]"
    },
    "profile_variant": {
      "decided_at": "2026-06-25T16:07:44Z",
      "decided_by": "Steven Caban",
      "decision_id": "detecto_v1:profile_variant",
      "selected_option": "keep_single_profile"
    },
    "row_exclusion_policy": {
      "decided_at": "2026-06-25T16:07:44Z",
      "decided_by": "Steven Caban",
      "decision_id": "detecto_v1:row_exclusion_policy",
      "selected_option": "keep_identifier_description_no_price_blocking"
    }
  },
  "default_values": {
    "account_number": {
      "manifest_field": "account_number",
      "required": false,
      "source": "manifest",
      "value": null
    },
    "contract_name": {
      "manifest_field": "contract_name",
      "required": false,
      "source": "manifest",
      "value": null
    },
    "contract_number": {
      "manifest_field": "contract_number",
      "required": true,
      "source": "manifest",
      "value": null
    },
    "currency": {
      "manifest_field": null,
      "required": false,
      "source": "constant",
      "value": "USD"
    },
    "effective_date": {
      "manifest_field": "effective_date",
      "required": true,
      "source": "manifest",
      "value": null
    },
    "expiration_date": {
      "manifest_field": "expiration_date",
      "required": false,
      "source": "manifest",
      "value": null
    },
    "location": {
      "manifest_field": "location",
      "required": false,
      "source": "manifest",
      "value": null
    }
  },
  "description": "Pilot profile for Detecto pricing workbooks in family F003.",
  "distributor_id": null,
  "distributor_name": "Detecto",
  "exception_rules": {
    "metadata_conflict": "blocking",
    "missing_uom": "warning",
    "required_metadata_missing": "blocking",
    "unknown_uom": "warning"
  },
  "header_rules": {
    "candidate_row_range": {
      "end": 30,
      "start": 20
    },
    "exact_header_row": 26,
    "merged_header_handling": "error",
    "minimum_header_match_score": 4,
    "multi_row_header": false,
    "normalized_header_matching": true,
    "optional_header_terms": [
      "UPC",
      "Item Description",
      "List Price",
      "Start Qty",
      "Stop Qty"
    ],
    "required_header_terms": [
      "Model",
      "Stock UOM",
      "Net Price",
      "Sales Description"
    ]
  },
  "notes": "Decision-applied v2 pilot profile. Status remains review_required and review_status remains not_reviewed. No unit conversions, each-price calculations, or unapproved price fallbacks are inferred.",
  "predecessor_profile": "detecto_v1",
  "predecessor_profile_version": "1.0.0",
  "profile_name": "detecto_v2",
  "profile_version": "2.0.0",
  "review_status": "not_reviewed",
  "reviewed_by": null,
  "schema_version": "1.0.0",
  "sheet_rules": {
    "case_insensitive_sheet_name": null,
    "exact_sheet_name": "Sheet1",
    "exclude_patterns": [],
    "include_hidden_sheets": false,
    "include_patterns": [],
    "process_multiple_matching_sheets": false,
    "regex_sheet_name": null
  },
  "status": "review_required",
  "transforms": [
    "normalize_identifier",
    "normalize_description",
    "normalize_uom",
    "parse_currency",
    "parse_decimal"
  ],
  "validation_rules": {
    "description_required": true,
    "expiration_date_nullable": true,
    "item_identifier_required": true,
    "metadata_source_policy": "manifest",
    "price_required": true,
    "required_metadata_fields": [
      "contract_number",
      "effective_date"
    ],
    "uom_warning_only": true
  },
  "workbook_match_rules": {
    "filename_patterns": [
      "Detecto.*Pricing.*\\.xlsx$"
    ],
    "forbidden_headers": [],
    "minimum_match_score": 8,
    "optional_headers": [
      "UPC",
      "List Price",
      "Start Qty",
      "Stop Qty"
    ],
    "required_headers": [
      "Model",
      "Item Description",
      "Stock UOM",
      "Net Price",
      "Sales Description"
    ],
    "sheet_name_patterns": [
      "^Sheet1$"
    ]
  }
}
